{
  "specVersion": "0.1",
  "recordType": "event",
  "eventId": "evt_5xnmm3vb0sfn61yrtr0nece402",
  "eventType": "proposal",
  "subjectType": "workflow",
  "subjectId": "wfl_0nd0m1dxe35ke860rweszzeq07",
  "actorRef": {
    "actorType": "participant",
    "actorId": "ptc_0k1ef5z2tzfntg5a1m3ezctfbw",
    "role": "buyer_counsel",
    "onBehalfOf": "ptc_00n9zj6rk31yr783ez9eknn2gb"
  },
  "previousStateRef": {
    "subjectType": "workflow",
    "subjectId": "wfl_0nd0m1dxe35ke860rweszzeq07",
    "version": 4,
    "state": "conditions_pending",
    "digest": {
      "algorithm": "sha-256",
      "value": "ae32ceff2f9a36076a97e4a22a4901507c92bb9f4249f5b5b207c995c2c763a4"
    }
  },
  "proposedStateRef": {
    "subjectType": "workflow",
    "subjectId": "wfl_0nd0m1dxe35ke860rweszzeq07",
    "version": 5,
    "state": "approved",
    "digest": {
      "algorithm": "sha-256",
      "value": "1ba5a977256980a7cb2bae99035b71965cb5f6410c261322ae533d713a51a3b2"
    }
  },
  "evidenceRefs": [
    "evd_6qzypatqh3xrkvarhwv373sdn6",
    "evd_0nm225t6aydft7a7021c48bdq6"
  ],
  "policyResultRefs": [
    "plr_23jrsnnbaxhmstbp9see4r16rm"
  ],
  "reasonCodes": [
    "conditions.fulfilment_notice"
  ],
  "provenance": {
    "channel": "direct_action"
  },
  "idempotencyKey": "syn-notice-of-fulfilment-0001",
  "timestamp": "2026-03-12T09:00:00Z",
  "metadata": {
    "novera:synthetic": true,
    "novera:label": "SYNTHETIC EXAMPLE DATA"
  }
}
