{
  "specVersion": "0.1",
  "recordType": "event",
  "eventId": "evt_6gadxaerwg7knv9e4ptkpk3ddn",
  "eventType": "state_transition",
  "subjectType": "workflow",
  "subjectId": "wfl_0nd0m1dxe35ke860rweszzeq07",
  "actorRef": {
    "actorType": "system",
    "actorId": "sys_79vjfk2e5pe1z3tr0q29dn5jpr"
  },
  "previousStateRef": {
    "subjectType": "workflow",
    "subjectId": "wfl_0nd0m1dxe35ke860rweszzeq07",
    "version": 4,
    "state": "conditions_pending",
    "digest": {
      "algorithm": "sha-256",
      "value": "ae32ceff2f9a36076a97e4a22a4901507c92bb9f4249f5b5b207c995c2c763a4"
    }
  },
  "proposedStateRef": {
    "subjectType": "workflow",
    "subjectId": "wfl_0nd0m1dxe35ke860rweszzeq07",
    "version": 5,
    "state": "approved",
    "digest": {
      "algorithm": "sha-256",
      "value": "1ba5a977256980a7cb2bae99035b71965cb5f6410c261322ae533d713a51a3b2"
    }
  },
  "confirmedStateRef": {
    "subjectType": "workflow",
    "subjectId": "wfl_0nd0m1dxe35ke860rweszzeq07",
    "version": 5,
    "state": "approved",
    "digest": {
      "algorithm": "sha-256",
      "value": "1ba5a977256980a7cb2bae99035b71965cb5f6410c261322ae533d713a51a3b2"
    }
  },
  "causedBy": [
    "evt_5xnmm3vb0sfn61yrtr0nece402",
    "evt_36r73tfebvmrhv6es9sbysyzaf",
    "evt_2f9e7b3t5dr0b5dt13y0wbtgfg"
  ],
  "evidenceRefs": [
    "evd_6qzypatqh3xrkvarhwv373sdn6",
    "evd_0nm225t6aydft7a7021c48bdq6",
    "evd_728ykdj0ambpba3d1c0qmhgmh7"
  ],
  "policyResultRefs": [
    "plr_23jrsnnbaxhmstbp9see4r16rm"
  ],
  "reasonCodes": [
    "conditions.all_met"
  ],
  "provenance": {
    "channel": "system_process"
  },
  "idempotencyKey": "syn-apply-wfl-purchase-v5",
  "timestamp": "2026-03-12T10:00:02Z",
  "metadata": {
    "novera:synthetic": true,
    "novera:label": "SYNTHETIC EXAMPLE DATA"
  }
}
